{
  "schema": "kor-travel-common.consumer-manifest.v1",
  "repo": "pinvi",
  "app": "apps/api",
  "tokens": { "version": null, "override": null },
  "ui": { "version": null },
  "python": { "version": null },
  "lockfiles": [
    { "kind": "uv", "path": "apps/api/uv.lock", "scope": "apps/api" }
  ],
  "contrast": { "baseline": null, "dark": false },
  "ux_gate": { "baseline": null },
  "openapi": { "exceptions": ["docs/standards/openapi-exceptions.yaml#pinvi"] },
  "exceptions": []
}
