{
  "schema": "kor-travel-common.consumer-manifest.v1",
  "repo": "kor-travel-map",
  "app": "admin",
  "tokens": { "version": null, "override": null },
  "ui": { "version": null },
  "python": { "version": null },
  "lockfiles": [
    { "kind": "npm", "path": "package-lock.json", "scope": "packages/kor-travel-map-admin/frontend" }
  ],
  "contrast": { "baseline": null, "dark": false },
  "ux_gate": { "baseline": null },
  "openapi": { "exceptions": ["docs/standards/openapi-exceptions.yaml#map"] },
  "exceptions": []
}
