{
  "schema": "kor-travel-common.consumer-manifest.v1",
  "repo": "kor-travel-concierge",
  "app": "frontend",
  "tokens": { "version": null, "override": null },
  "ui": { "version": null },
  "python": { "version": null },
  "lockfiles": [
    { "kind": "npm", "path": "frontend/package-lock.json", "scope": "root" },
    { "kind": "requirements", "path": "backend/requirements.txt", "scope": "backend" },
    { "kind": "requirements", "path": "etl/requirements.txt", "scope": "etl" },
    { "kind": "requirements", "path": "mcp/requirements.txt", "scope": "mcp" },
    { "kind": "requirements", "path": "scheduler/requirements.txt", "scope": "scheduler" }
  ],
  "contrast": { "baseline": null, "dark": false },
  "ux_gate": { "baseline": null },
  "openapi": { "exceptions": ["docs/standards/openapi-exceptions.yaml#concierge"] },
  "exceptions": []
}
